醫事機構代碼,醫事機構名稱,醫事機構地址,address_clean,latitude,longitude,醫事機構電話,成人口罩剩餘數,兒童口罩剩餘數,來源資料時間
5931023116,宏安藥局,新北市三重區集美街１５８號１樓,新北市三重區集美街158號1樓,25.0531206,121.4898996,(02)29785866,9394,1107,2020/09/15 21:44:46
5931023161,烈委藥局,新北市三重區五華街１３２號,新北市三重區五華街132號,25.0835861,121.491607,(02)89812846,1913,540,2020/09/15 21:44:46
5931023198,成立藥局,新北市三重區正義北路３１０－１號２樓,新北市三重區正義北路310-1號2樓,25.0700287,121.4950754,(02)89852355,13396,1080,2020/09/15 21:44:46
5931023223,兒安藥局,新北市三重區中華路５９號,新北市三重區中華路59號,25.0622703,121.4835859,(02)29897558,12563,1519,2020/09/15 21:44:46
5931023349,迪化藥局,新北市三重區中華路７７號,新北市三重區中華路77號,25.062637,121.483732,(02)29834445,6489,1150,2020/09/15 21:44:46
5931023401,正大藥局,新北市三重區五華街３９號,新北市三重區五華街39號,25.0811215,121.4945669,(02)89815931,1978,525,2020/09/15 21:44:46
5931023447,安泰藥局,新北市三重區正義北路３００－３號２樓,新北市三重區正義北路300-3號2樓,25.0697354,121.4952742,(02)89815379,4034,2097,2020/09/15 21:44:46
5931023527,德慈藥局,新北市三重區重新路３段１６號１樓,新北市三重區重新路3段16號1樓,25.0612271,121.4951499,(02)29736693,5666,1100,2020/09/15 21:44:46
5931023536,江村藥局,新北市三重區重新路３段９號,新北市三重區重新路3段9號,25.0618129,121.495274,(02)29821024,10310,811,2020/09/15 21:44:46
5931023563,寶貝藥局,新北市三重區仁愛街３０２－１號,新北市三重區仁愛街302-1號,25.079262,121.492006,(02)29802190,3478,435,2020/09/15 21:44:46
5931023581,大重仁藥局,新北市三重區重新路５段５９２號１樓,新北市三重區重新路5段592號1樓,25.0453697,121.4693377,(02)29958283,11544,650,2020/09/15 21:44:46
5931023625,聖美膚藥局,新北市三重區正義北路１３０號,新北市三重區正義北路130號,25.0657312,121.4966428,(02)29863456,5433,818,2020/09/15 21:44:46
5931023670,誠泰藥師藥局,新北市三重區重新路３段１０２號,新北市三重區重新路3段102號,25.0604267,121.4927083,(02)89721125,1490,1340,2020/09/15 21:44:46
5931023732,松泰藥師藥局,新北市三重區大同北路６５號,新北市三重區大同北路65號,25.063577,121.495258,(02)29859593,0,900,2020/09/15 21:44:46
5931023750,興安藥局,新北市三重區正義北路２７５之１號,新北市三重區正義北路275之1號,25.0702241,121.4953341,(02)29885795,11587,623,2020/09/15 21:44:46
5931023830,忠信藥局,新北市三重區仁興街３２號,新北市三重區仁興街32號,25.0754814,121.4989907,(02)29730020,8426,1852,2020/09/15 21:44:46
5931023858,開元藥局,新北市三重區正義北路３２４號２樓,新北市三重區正義北路324號2樓,25.0703929,121.4947976,(02)29873976,17259,1172,2020/09/15 21:44:46
5931023901,銘泰藥局,新北市三重區三和路４段１５３號２樓,新北市三重區三和路4段153號2樓,25.078446,121.4839103,(02)22865092,15,147,2020/09/15 21:44:46
5931023910,德河藥局,新北市三重區自強路１段３２０號,新北市三重區自強路1段320號,25.0684359,121.490929,(02)0229869850,12403,790,2020/09/15 21:44:46
5931024088,美滿藥局,新北市三重區中華路１６號,新北市三重區中華路16號,25.0606177,121.4833377,(02)89824272,3933,1615,2020/09/15 21:44:46
5931024097,義榮藥局,新北市三重區三和路２段１４２號１樓,新北市三重區三和路2段142號1樓,25.0682269,121.4995371,(02)29727598,462,512,2020/09/15 21:44:46
5931024168,合康健保藥局,新北市三重區三和路４段３８４號１樓,新北市三重區三和路4段384號1樓,25.0788896,121.4823773,(02)22869999,378,200,2020/09/15 21:44:46
5931024355,天賜藥局,新北市三重區自強路１段８５號１樓,新北市三重區自強路1段85號1樓,25.0665828,121.496094,(02)29856852,4068,558,2020/09/15 21:44:46
5931024373,予康藥局,新北市三重區文化北路１９８號１樓,新北市三重區文化北路198號1樓,25.0679178,121.4979573,(02)89858789,9866,1868,2020/09/15 21:44:46
5931024408,幸福藥妝藥局,新北市三重區正義北路３４２號１樓,新北市三重區正義北路342號1樓,25.0708108,121.4942918,(02)29896858,154,726,2020/09/15 21:44:46
5931024426,甜心健康生活藥局,新北市三重區福祉里集美街４５號１樓,新北市三重區福祉里集美街45號1樓,25.055393,121.487941,(02)29762223,4033,0,2020/09/15 21:44:46
5931024462,惠理藥局,新北市三重區重陽路１段１５２號,新北市三重區重陽路1段152號,25.0610386,121.4864874,(02)29856710,3,0,2020/09/15 21:44:46
5931024499,信承藥局,新北市三重區信義西街４４號１樓,新北市三重區信義西街44號1樓,25.0645782,121.4982123,(02)29866476,2854,1470,2020/09/15 21:44:46
5931024515,陳藥局,新北市三重區三民街７７號,新北市三重區三民街77號,25.0630069,121.485839,(02)29848601,6543,621,2020/09/15 21:44:46
5931024524,陽明藥師藥局,新北市三重區三和路４段１６３巷１５號,新北市三重區三和路4段163巷15號,25.0787732,121.483877,(02)22867848,1864,1058,2020/09/15 21:44:46
5931024551,樂活處方箋藥局,新北市三重區中正北路９９號１樓,新北市三重區中正北路99號1樓,25.0633282,121.4897331,(02)29805182,1379,345,2020/09/15 21:44:46
5931024588,陽光藥師藥局,新北市三重區三和路２段１８２號１樓,新北市三重區三和路2段182號1樓,25.0688056,121.4987964,(02)29788120,1703,711,2020/09/15 21:44:46
5931024622,萊康健保藥局,新北市三重區溪尾街１７６號１樓,新北市三重區溪尾街176號1樓,25.0806584,121.4885236,(02)82871076,1276,847,2020/09/15 21:44:46
5931024631,德榮藥局,新北市三重區中華路９１號１樓,新北市三重區中華路91號1樓,25.062962,121.483728,(02)29717291,2779,710,2020/09/15 21:44:46
5931024677,博愛藥局,新北市三重區三民街２２０號１樓,新北市三重區三民街220號1樓,25.0671107,121.4802349,(02)29711606,171,0,2020/09/15 21:44:46
5931024695,仁華藥局,新北市三重區五華街７３－１號１樓,新北市三重區五華街73-1號1樓,25.0830385,121.4924832,(02)29806161,1050,680,2020/09/15 21:44:46
5931024711,臻燿藥局,新北市三重區集美街１５０號１樓,新北市三重區集美街150號1樓,25.0531549,121.489765,(02)29724765,3869,961,2020/09/15 21:44:46
5931024784,中華健保藥局,新北市三重區中華路９５號,新北市三重區中華路95號,25.0630941,121.4836943,(02)29813155,3372,289,2020/09/15 21:44:46
5931024891,康慈藥局,新北市三重區忠孝路２段４０號１樓,新北市三重區忠孝路2段40號1樓,25.0704879,121.485378,(02)89813529,6457,1305,2020/09/15 21:44:46
5931024908,力行德榮藥局,新北市三重區力行路２段１７０號１樓,新北市三重區力行路2段170號1樓,25.0769459,121.482963,(02)22867170,7423,989,2020/09/15 21:44:46
5931024935,健康藥局,新北市三重區安樂街５８號１樓,新北市三重區安樂街58號1樓,25.0694008,121.4953046,(02)29841882,11231,411,2020/09/15 21:44:46
5931024944,康希藥局,新北市三重區三和路２段８３號１樓,新北市三重區三和路2段83號1樓,25.0682622,121.4999466,(02)89728298,229,180,2020/09/15 21:44:46
5931024962,建祥三和藥局,新北市三重區三和路２段１６０號１樓,新北市三重區三和路2段160號1樓,25.0685019,121.49928,(02)29703379,0,853,2020/09/15 21:44:46
5931024971,欽勝藥局,新北市三重區重陽路４段６號２樓,新北市三重區重陽路4段6號2樓,25.06898,121.490531,(02)29857389,1005,1032,2020/09/15 21:44:46
5931025110,慈惠藥局,新北市三重區仁愛街５１６號１、２樓,新北市三重區仁愛街516號1、2樓,25.0819313,121.4871876,(02)22809009,1301,390,2020/09/15 21:44:46
5931025174,小林健保藥局,新北市三重區文化北路６１－１號１樓,新北市三重區文化北路61-1號1樓,25.0663138,121.4987144,(02)29763895,1117,945,2020/09/15 21:44:46
5931025192,榮康藥局,新北市三重區成功路８１號１樓,新北市三重區成功路81號1樓,25.051372,121.488769,(02)29772723,1770,959,2020/09/15 21:44:46
5931025236,祐銘藥局,新北市三重區龍門路２２號１樓,新北市三重區龍門路22號1樓,25.0720301,121.4953266,(02)29769001,5689,1162,2020/09/15 21:44:46
5931025245,黎明藥師藥局,新北市三重區三和路４段２２７號１樓,新北市三重區三和路4段227號1樓,25.079827,121.481264,(02)82870958,10720,2295,2020/09/15 21:44:46
5931025254,仁愛健保藥局,新北市三重區力行路２段１５３號,新北市三重區力行路2段153號,25.0775982,121.4838204,(02)22805160,765,420,2020/09/15 21:44:46
5931025281,吉盛健保藥局,新北市三重區頂崁街２１０巷４６號１樓,新北市三重區頂崁街210巷46號1樓,25.0679476,121.4752628,(02)29801666,643,10,2020/09/15 21:44:46
5931025290,康新藥局,新北市三重區正義北路１８５號２樓,新北市三重區正義北路185號2樓,25.067861,121.4964063,(02)29865982,13402,928,2020/09/15 21:44:46
5931025307,佑全三重正義藥局,新北市三重區正義北路２０７號１、２樓；２０９號１、２樓,新北市三重區正義北路207號1、2樓;209號1、2樓,25.0685426,121.4961624,(02)29815341,5087,1806,2020/09/15 21:44:46
5931025361,宗安藥師藥局,新北市三重區頂崁街２０８號１樓,新北市三重區頂崁街208號1樓,25.0672312,121.4772275,(02)29874243,5961,230,2020/09/15 21:44:46
5931025370,晨星藥局,新北市三重區五華街１２３號１樓,新北市三重區五華街123號1樓,25.0840582,121.4913942,(02)89856533,3456,958,2020/09/15 21:44:46
5931025398,昌誠藥局,新北市三重區三和路４段１６１號１樓,新北市三重區三和路4段161號1樓,25.0786018,121.4835652,(02)22876338,5929,1160,2020/09/15 21:44:46
5931025432,利民藥局,新北市三重區自強路１段１７１號、１７３號１樓及２樓,新北市三重區自強路1段171號、173號1樓及2樓,25.0668864,121.4940644,(02)29852826,4190,870,2020/09/15 21:44:46
5931025441,尚好藥局,新北市三重區力行路２段１４２號１樓,新北市三重區力行路2段142號1樓,25.076113,121.482295,(02)22863232,1435,0,2020/09/15 21:44:46
5931025503,德心藥局,新北市三重區三和路４段３２４號１樓,新北市三重區三和路4段324號1樓,25.078051,121.483646,(02)82878101,14857,1240,2020/09/15 21:44:46
5931025521,徐匯藥局,新北市三重區仁愛街７５５號１樓,新北市三重區仁愛街755號1樓,25.0804709,121.48127,(02)28572234,8691,1022,2020/09/15 21:44:46
5931025549,吉康健保藥局,新北市三重區三民街２７９號１樓,新北市三重區三民街279號1樓,25.0682518,121.4791422,(02)89810122,1155,1040,2020/09/15 21:44:46
5931025558,藥比健保藥局,新北市三重區成功路１０２號１樓,新北市三重區成功路102號1樓,25.0513033,121.4877624,(02)29730069,5219,1670,2020/09/15 21:44:46
5931025567,閎安藥局,新北市三重區重新路２段８５號１樓、２樓,新北市三重區重新路2段85號1樓、2樓,25.0618992,121.4961681,(02)29881968,0,3307,2020/09/15 21:44:46
5931025610,大樹三重藥局,新北市三重區正義北路６６號１樓,新北市三重區正義北路66號1樓,25.064198,121.497182,(02)29713188,7026,650,2020/09/15 21:44:46
5931025638,華安生活藥局,新北市三重區重新路２段１２６號１樓,新北市三重區重新路2段126號1樓,25.0614819,121.4962393,(02)29756534,3483,1056,2020/09/15 21:44:46
5931025647,幸康藥局,新北市三重區正義北路２０５號２樓,新北市三重區正義北路205號2樓,25.068369,121.4962532,(02)29816052,12498,190,2020/09/15 21:44:46
5931025656,煜安健保藥局,新北市三重區光明路２３號１樓,新北市三重區光明路23號1樓,25.058461,121.491026,(02)29768128,2864,1414,2020/09/15 21:44:46
5931025665,宏原健保藥局,新北市三重區中正北路１８３號１樓,新北市三重區中正北路183號1樓,25.0696054,121.477645,(02)29871515,1292,490,2020/09/15 21:44:46
5931025683,政昇藥局,新北市三重區正義北路１２３號２樓之３,新北市三重區正義北路123號2樓之3,25.0661132,121.4968997,(02)29815690,10720,2093,2020/09/15 21:44:46
5931025709,重新藥局,新北市三重區重新路４段１２號１樓,新北市三重區重新路4段12號1樓,25.0576383,121.4887337,(02)29742700,7402,920,2020/09/15 21:44:46
5931025718,幸聲藥局,新北市三重區正義北路２３９號２樓,新北市三重區正義北路239號2樓,25.0693311,121.4959114,(02)29715353,1231,1563,2020/09/15 21:44:46
5931025727,仁美藥局,新北市三重區慈愛街５１號１、２樓,新北市三重區慈愛街51號1、2樓,25.0791262,121.4860833,(02)22805150,4640,0,2020/09/15 21:44:46
5931025736,五華春天生活藥局,新北市三重區五華街７３號１、２樓,新北市三重區五華街73號1、2樓,25.0830385,121.4924832,(02)29876838,3146,760,2020/09/15 21:44:46
5931025745,恆源藥局,新北市三重區仁興街２８巷４１號１樓,新北市三重區仁興街28巷41號1樓,25.075214,121.4981581,(02)29765002,2284,1083,2020/09/15 21:44:46
5931025754,躍獅欣欣藥局,新北市三重區正義北路２３３號１樓,新北市三重區正義北路233號1樓,25.0691437,121.4960132,(02)29816955,6273,1768,2020/09/15 21:44:46
5931025763,美康三和藥局,新北市三重區三和路４段３２２號１、２樓,新北市三重區三和路4段322號1、2樓,25.0780213,121.4839743,(02)22866858,2523,1067,2020/09/15 21:44:46
5931025781,芯慈藥局,新北市三重區永安北路２段１０５號１樓,新北市三重區永安北路2段105號1樓,25.0838376,121.4832204,(02)28570670,3190,780,2020/09/15 21:44:46
5931025790,銀河藥局,新北市三重區五華街２４７號１樓,新北市三重區五華街247號1樓,25.086265,121.4891972,(02)28578688,5364,740,2020/09/15 21:44:46
5931025807,永福藥局,新北市三重區永福街３號１樓,新北市三重區永福街3號1樓,25.0784201,121.4828318,(02)22861161,12988,657,2020/09/15 21:44:46
5931025816,安立藥局,新北市三重區正義北路３１７號１樓,新北市三重區正義北路317號1樓,25.0713054,121.4941512,(02)89852926,16299,1108,2020/09/15 21:44:46
5931025825,美康中正北藥局,新北市三重區中正北路１４９號１樓２樓,新北市三重區中正北路149號1樓2樓,25.0676153,121.4825989,29882836,1369,710,2020/09/15 21:44:46
5931030013,皇誼藥局,新北市永和區文化路３３號,新北市永和區文化路33號,25.0150061,121.5146951,(02)29278732,3792,748,2020/09/15 21:44:46
5931030264,永達大藥局,新北市永和區大新街２號,新北市永和區大新街2號,25.0085217,121.5145621,(02)29213326,2091,30,2020/09/15 21:44:46
5931030317,聖英藥局,新北市永和區福和路５５－１號,新北市永和區福和路55-1號,25.0078681,121.5231457,(02)29293613,2781,1213,2020/09/15 21:44:46
5931030531,成功藥局,新北市永和區成功路１段１３３號,新北市永和區成功路1段133號,24.9941823,121.5263996,(02)29293622,1936,374,2020/09/15 21:44:46
5931030540,易安堂藥局,新北市永和區民光街２２巷２號,新北市永和區民光街22巷2號,24.9957431,121.5158703,(02)29431932,3989,768,2020/09/15 21:44:46
5931030568,仲景藥局,新北市永和區竹林路２１３巷１號,新北市永和區竹林路213巷1號,25.0090224,121.5210908,(02)89281687,2865,125,2020/09/15 21:44:46
5931030639,家宏藥局,新北市永和區成功路２段１２３號,新北市永和區成功路2段123號,24.9984418,121.5267959,(02)29256856,4723,750,2020/09/15 21:44:46
5931030782,佳民藥局,新北市永和區永貞路２３８號,新北市永和區永貞路238號,25.0039345,121.5147749,(02)29201678,1132,503,2020/09/15 21:44:46
5931030960,中正藥局,新北市永和區中正路４３９號,新北市永和區中正路439號,25.0052051,121.5170396,(02)29219213,3021,920,2020/09/15 21:44:46
5931032099,德和便利藥局,新北市永和區得和路１９４號１樓,新北市永和區得和路194號1樓,24.999633,121.520081,(02)89431417,1800,0,2020/09/15 21:44:46
5931032133,宸安藥局,新北市永和區得和路３８５號１樓,新北市永和區得和路385號1樓,24.9994132,121.5250097,(02)22328274,2342,530,2020/09/15 21:44:46
5931032188,原大藥局,新北市永和區永和路１段２０號１樓,新北市永和區永和路1段20號1樓,25.0031104,121.4997177,(02)29272767,1846,720,2020/09/15 21:44:46
5931032286,宏瑞藥局,新北市永和區文化路７８號,新北市永和區文化路78號,25.0153143,121.5141811,(02)32330993,4102,1240,2020/09/15 21:44:46
5931032311,立安藥局,新北市永和區永和路２段２０３號１樓,新北市永和區永和路2段203號1樓,25.0137116,121.5153062,(02)89211786,4689,370,2020/09/15 21:44:46
5931032339,宜泰藥局,新北市永和區永貞路２９７號,新北市永和區永貞路297號,25.005615,121.510756,(02)89210657,5082,1340,2020/09/15 21:44:46
5931032419,台大藥局,新北市永和區保平路２４０號,新北市永和區保平路240號,25.00545,121.5091192,(02)29242484,3773,42,2020/09/15 21:44:46
5931032473,竹林藥局,新北市永和區竹林路１８１號２樓,新北市永和區竹林路181號2樓,25.0097509,121.5207149,(02)89266818,2444,560,2020/09/15 21:44:46
5931032633,橘子藥局,新北市永和區仁愛路２９８號１樓,新北市永和區仁愛路298號1樓,25.0080914,121.5035092,(02)32330390,2769,118,2020/09/15 21:44:46
5931032731,得安藥局,新北市永和區永元路２４號１樓,新北市永和區永元路24號1樓,25.0006438,121.5222994,(02)29230568,5284,1022,2020/09/15 21:44:46
5931032759,友辰藥局,新北市永和區中正路３８０號１樓,新北市永和區中正路380號1樓,25.001296,121.5177441,(02)29267131,3278,1424,2020/09/15 21:44:46
5931032811,華特健康藥局,新北市永和區永貞路３６２號１樓,新北市永和區永貞路362號1樓,25.0067023,121.5101782,(02)29264391,2190,2247,2020/09/15 21:44:46
5931032875,上安藥局,新北市永和區仁愛路８０號１樓,新北市永和區仁愛路80號1樓,25.0133283,121.5126657,(02)22328565,1800,370,2020/09/15 21:44:46
5931032955,博輝藥局,新北市永和區中興街６０號１樓,新北市永和區中興街60號1樓,25.0115725,121.5170682,(02)89211766,396,860,2020/09/15 21:44:46
5931032964,德上藥局,新北市永和區中正路１０６號,新北市永和區中正路106號,24.9959563,121.5144742,(02)89411077,3294,1950,2020/09/15 21:44:46
5931033023,榮總藥局,新北市永和區信義路１５號１樓,新北市永和區信義路15號1樓,25.0119509,121.5143307,(02)29216596,10486,2145,2020/09/15 21:44:46
5931033032,弘光藥局,新北市永和區竹林路中興里６６巷１９號１樓,新北市永和區竹林路中興里66巷19號1樓,25.0135121,121.5183153,(02)29282000,2223,590,2020/09/15 21:44:46
5931033078,博昇藥局,新北市永和區仁愛路２２號１樓,新北市永和區仁愛路22號1樓,25.013712,121.514742,(02)29267273,1620,830,2020/09/15 21:44:46
5931033087,康宏安藥局,新北市永和區保福路２段７８號１樓,新北市永和區保福路2段78號1樓,25.0132379,121.5105683,(02)29288118,4438,990,2020/09/15 21:44:46
5931033103,皇家藥師藥局,新北市永和區中正路７２０號１樓,新北市永和區中正路720號1樓,25.010099,121.516036,(02)89216867,1972,875,2020/09/15 21:44:46
5931033130,永利藥局,新北市永和區永利路９、１１號１樓,新北市永和區永利路9、11號1樓,25.0061617,121.5176635,(02)29291655,4231,990,2020/09/15 21:44:46
5931033194,廣惠藥局,新北市永和區中正路６４９號２樓,新北市永和區中正路649號2樓,25.0101029,121.5151124,(02)29290675,0,820,2020/09/15 21:44:46
5931033201,級立健保藥局,新北市永和區保平路１３９號１樓,新北市永和區保平路139號1樓,25.0059692,121.5101538,(02)29299995,3658,1243,2020/09/15 21:44:46
5931033363,保安藥局,新北市永和區保安路２１２號１樓,新北市永和區保安路212號1樓,25.0138959,121.5075141,(02)29277623,1469,1080,2020/09/15 21:44:46
5931033461,常安中西藥局,新北市永和區保平路２６號１樓,新北市永和區保平路26號1樓,25.007602,121.512146,(02)29283530,5043,1092,2020/09/15 21:44:46
5931033523,永奕藥局,新北市永和區永平路２８６之１號１樓,新北市永和區永平路286之1號1樓,25.012068,121.507752,(02)22327709,2181,750,2020/09/15 21:44:46
5931033578,悅美保健藥局,新北市永和區保生路２２巷２１號１樓,新北市永和區保生路22巷21號1樓,25.007969,121.506552,(02)22323515,2553,586,2020/09/15 21:44:46
5931033603,安安藥局,新北市永和區竹林路２０３號１樓,新北市永和區竹林路203號1樓,25.009109,121.520872,(02)89263651,1885,84,2020/09/15 21:44:46
5931033621,永正健康人生藥局,新北市永和區中正路１９１、１９３號１樓、１９７號２樓,新北市永和區中正路191、193號1樓、197號2樓,24.9993349,121.5169913,(02)29467351,2212,2510,2020/09/15 21:44:46
5931033649,敦品民治藥局,新北市永和區民治街８１號１樓,新北市永和區民治街81號1樓,24.998102,121.5174746,(02)29494150,795,2030,2020/09/15 21:44:46
5931033774,台化藥局,新北市永和區勵行街１１９號１樓,新北市永和區勵行街119號1樓,25.0120157,121.5175409,(02)22318585,5424,740,2020/09/15 21:44:46
5931033783,星韻藥局,新北市永和區福和路８８號,新北市永和區福和路88號,25.0081646,121.5227043,(02)89282999,1500,880,2020/09/15 21:44:46
5931033792,明慧藥師藥局,新北市永和區仁愛路２９５號１樓,新北市永和區仁愛路295號1樓,25.0091749,121.505334,(02)29297118,881,1190,2020/09/15 21:44:46
5931033863,欣安大藥局,新北市永和區福和路２２１號１樓,新北市永和區福和路221號1樓,25.0074878,121.5188648,(02)22326685,4025,90,2020/09/15 21:44:46
5931033881,十路藥局,新北市永和區永貞路１６４號１樓,新北市永和區永貞路164號1樓,25.004388,121.5170343,(02)29258955,5946,150,2020/09/15 21:44:46
5931033890,康杏安藥局,新北市永和區保平路６０號１樓,新北市永和區保平路60號1樓,25.0069199,121.511004,(02)29298968,4319,800,2020/09/15 21:44:46
5931033925,康和藥局,新北市永和區中和路５８９號１樓,新北市永和區中和路589號1樓,25.0039906,121.512107,(02)22310300,1112,1178,2020/09/15 21:44:46
5931033943,崇恩藥局,新北市永和區成功路２段１３５號１樓,新北市永和區成功路2段135號1樓,24.9981045,121.5267438,(02)89214022,5400,201,2020/09/15 21:44:46
5931033961,永和大樹藥局,新北市永和區福和路１４３號１、２樓,新北市永和區福和路143號1、2樓,25.00749,121.520786,(02)29233377,3326,1530,2020/09/15 21:44:46
5931033989,悠活藥局,新北市永和區得和路３３０號１樓,新北市永和區得和路330號1樓,24.9993298,121.523429,(02)31516288,1805,0,2020/09/15 21:44:46
5931033998,新資生永貞大藥局,新北市永和區永貞路４２９號１樓,新北市永和區永貞路429號1樓,25.0095712,121.5069546,(02)29227202,4488,1039,2020/09/15 21:44:46
5931034011,律安藥局,新北市永和區中和路３２１號１樓,新北市永和區中和路321號1樓,24.9997899,121.50713,29287212,90,593,2020/09/15 21:44:46
5931034039,叁品藥局,新北市永和區秀朗路２段１１８號１樓,新北市永和區秀朗路2段118號1樓,25.00154,121.5244631,29208800,2014,1430,2020/09/15 21:44:46
5931034048,崇恩藥局,新北市永和區成功路二段１３５號１樓,新北市永和區成功路二段135號1樓,24.9981045,121.5267438,(02)89214022,1621,848,2020/09/15 21:44:46
5931034057,佑全永和中山藥局,新北市永和區中山路１段２２７、２２９、２３１號１樓,新北市永和區中山路1段227、229、231號1樓,25.0076479,121.508114,(02)22331546,656,1078,2020/09/15 21:44:46
5931040019,大榮藥局,新北市中和區中山路２段１２７號,新北市中和區中山路2段127號,25.0033243,121.5026126,(02)22497965,4468,300,2020/09/15 21:44:46
5931040037,溫莎藥局,新北市中和區員山路２９２號,新北市中和區員山路292號,25.002417,121.481418,(02)82277275,4458,170,2020/09/15 21:44:46
5931040055,瑞發藥局,新北市中和區民享街５６－１號,新北市中和區民享街56-1號,25.002243,121.474027,(02)22235319,4302,890,2020/09/15 21:44:46
5931040082,中和光田藥局,新北市中和區連城路４８號,新北市中和區連城路48號,25.001786,121.497938,(02)22459602,6266,910,2020/09/15 21:44:46
5931040144,安康藥局,新北市中和區圓通路３０９號,新北市中和區圓通路309號,24.9907481,121.4932065,(02)22450837,3150,930,2020/09/15 21:44:46
5931040153,上仁藥局,新北市中和區中山路２段１３１巷１１－１號,新北市中和區中山路2段131巷11-1號,25.0023689,121.502976,(02)22480074,6588,690,2020/09/15 21:44:46
5931040180,福雄藥局,新北市中和區景平路５４０號,新北市中和區景平路540號,24.994719,121.502578,(02)22499894,4267,1160,2020/09/15 21:44:46
5931040215,華新藥局,新北市中和區華新街７３號,新北市中和區華新街73號,24.9839648,121.508201,(02)29448345,216,1090,2020/09/15 21:44:46
5931040224,欣祥藥局,新北市中和區民德路７４－１號,新北市中和區民德路74-1號,25.0017179,121.4687407,(02)29646442,2517,450,2020/09/15 21:44:46
