醫事機構代碼,醫事機構名稱,醫事機構地址,address_clean,latitude,longitude,醫事機構電話,成人口罩剩餘數,兒童口罩剩餘數,來源資料時間
5935030108,吉泰藥局,苗栗縣通霄鎮通西里和平路29號,苗栗縣通霄鎮通西里和平路29號,24.4890375,120.679767,(037)758595,5512,1820,2020/09/15 21:44:46
5935030153,維康藥局,苗栗縣通霄鎮信義路１０４號,苗栗縣通霄鎮信義路104號,24.4881228,120.6802707,(037)750000,2403,740,2020/09/15 21:44:46
5935030171,立安藥局,苗栗縣通霄鎮信義路１０７號,苗栗縣通霄鎮信義路107號,24.4887512,120.6803592,(037)760100,3663,0,2020/09/15 21:44:46
5935040033,快樂藥局,苗栗縣竹南鎮照南里中山路１７８號,苗栗縣竹南鎮照南里中山路178號,24.687222,120.8800899,(037)474158,3807,120,2020/09/15 21:44:46
5935040079,德安藥局,苗栗縣竹南鎮光復路４０號,苗栗縣竹南鎮光復路40號,24.6842,120.879308,(037)479933,1899,0,2020/09/15 21:44:46
5935040257,和安藥局,苗栗縣竹南鎮竹南里博愛街１５號,苗栗縣竹南鎮竹南里博愛街15號,24.686469,120.879474,(037)472332,2943,1310,2020/09/15 21:44:46
5935040266,鴻仁大藥局,苗栗縣竹南鎮竹南里博愛街１８１號,苗栗縣竹南鎮竹南里博愛街181號,24.6867601,120.874047,(037)462396,1949,895,2020/09/15 21:44:46
5935040328,明志藥局,苗栗縣竹南鎮照南里博愛街４號,苗栗縣竹南鎮照南里博愛街4號,24.686867,120.879728,(037)472341,4438,1495,2020/09/15 21:44:46
5935040408,光復藥局,苗栗縣竹南鎮光復路２１６號,苗栗縣竹南鎮光復路216號,24.688734,120.87959,(037)476286,5733,0,2020/09/15 21:44:46
5935041450,昇暉藥局,苗栗縣竹南鎮民治街１８號,苗栗縣竹南鎮民治街18號,24.684973,120.8792007,(037)464347,1810,422,2020/09/15 21:44:46
5935041469,順春藥局,苗栗縣竹南鎮延平路２７號之１２,苗栗縣竹南鎮延平路27號之12,24.6858344,120.876739,(037)552068,5804,1040,2020/09/15 21:44:46
5935041496,清三藥局,苗栗縣竹南鎮博愛街１６２號,苗栗縣竹南鎮博愛街162號,24.68717,120.875114,(037)470532,3897,937,2020/09/15 21:44:46
5935041610,林新藥局,苗栗縣竹南鎮博愛街１２４號,苗栗縣竹南鎮博愛街124號,24.6869612,120.8760446,(037)471556,4712,1655,2020/09/15 21:44:46
5935041629,悅昌藥局,苗栗縣竹南鎮中正路２８號一樓,苗栗縣竹南鎮中正路28號一樓,24.6840949,120.8789182,(037)477195,3330,0,2020/09/15 21:44:46
5935041736,佑仁藥局,苗栗縣竹南鎮光復路120號,苗栗縣竹南鎮光復路120號,24.686255,120.879466,(037)470250,1503,770,2020/09/15 21:44:46
5935041745,瑞士藥師藥局,苗栗縣竹南鎮和平街59號,苗栗縣竹南鎮和平街59號,24.6854437,120.8774534,(037)552708,4532,0,2020/09/15 21:44:46
5935041781,惠家藥局,苗栗縣竹南鎮自強街４２號,苗栗縣竹南鎮自強街42號,24.6913883,120.8791222,(037)463635,4581,860,2020/09/15 21:44:46
5935041790,慈濟藥局,苗栗縣竹南鎮正南里光復路29號,苗栗縣竹南鎮正南里光復路29號,24.6838105,120.8789682,(037)474849,3017,1677,2020/09/15 21:44:46
5935041905,米樂中西健保藥局,苗栗縣竹南鎮大營路２０７號,苗栗縣竹南鎮大營路207號,24.6879576,120.8727415,(037)552116,4716,470,2020/09/15 21:44:46
5935041914,合康連鎖藥局,苗栗縣竹南鎮博愛街２７０號,苗栗縣竹南鎮博愛街270號,24.68726,120.8724126,(037)474987,2862,240,2020/09/15 21:44:46
5935041932,佑民藥局,苗栗縣竹南鎮守法街２－１２號,苗栗縣竹南鎮守法街2-12號,24.6818902,120.8683322,(037)241126,4518,1440,2020/09/15 21:44:46
5935041950,建康藥局,苗栗縣竹南鎮民治街６號,苗栗縣竹南鎮民治街6號,24.6850053,120.8796103,(037)483293,3452,0,2020/09/15 21:44:46
5935041987,杏一竹南中正藥局,苗栗縣竹南鎮中正路２５７號１樓,苗栗縣竹南鎮中正路257號1樓,24.6834372,120.8729666,(037)480602,5103,80,2020/09/15 21:44:46
5935041996,新欣藥局,苗栗縣竹南鎮龍山路一段１６０號１樓,苗栗縣竹南鎮龍山路一段160號1樓,24.6921507,120.8665432,(037)471503,3671,918,2020/09/15 21:44:46
5935042037,康壯藥局,苗栗縣竹南鎮博愛街４３９號,苗栗縣竹南鎮博愛街439號,24.6890068,120.8655357,(037)463732,5575,0,2020/09/15 21:44:46
5935042046,永安藥局,苗栗縣竹南鎮照南里立達街３號,苗栗縣竹南鎮照南里立達街3號,24.6886587,120.8766999,(037)469333,4860,10,2020/09/15 21:44:46
5935042055,崧博藥師藥局,苗栗縣竹南鎮龍山路３段３７號,苗栗縣竹南鎮龍山路3段37號,24.701651,120.877508,(037)639822,2864,104,2020/09/15 21:44:46
5935050066,義春藥局,苗栗縣頭份市珊湖里中正三路７２號,苗栗縣頭份市珊湖里中正三路72號,24.6808826,120.9556746,(037)601433,1423,353,2020/09/15 21:44:46
5935050164,辰安藥局,苗栗縣頭份市尖豐路３２號,苗栗縣頭份市尖豐路32號,24.663568,120.880293,(037)633632,2457,1551,2020/09/15 21:44:46
5935050182,民昌藥局,苗栗縣頭份市忠孝里信東路１３０號,苗栗縣頭份鎮忠孝里信東路130號,24.6897426,120.9095498,(037)673 232,1549,0,2020/09/15 21:44:46
5935050208,三峰藥局,苗栗縣頭份市新華里中正一路７８號,苗栗縣頭份市新華里中正一路78號,24.6864751,120.925886,(037)668239,4896,180,2020/09/15 21:44:46
5935050253,泉興藥局,苗栗縣頭份市仁愛里民族路２８號,苗栗縣頭份市仁愛里民族路28號,24.68302,120.907368,(037)664367,3429,140,2020/09/15 21:44:46
5935050262,東仙藥局,苗栗縣頭份市蟠桃里建國路１９９號,苗栗縣頭份市蟠桃里建國路199號,24.696591,120.9082429,(037)667267,3348,763,2020/09/15 21:44:46
5935050280,李藥局,苗栗縣頭份市珊湖里中正三路２１８號,苗栗縣頭份市珊湖里中正三路218號,24.683408,120.958205,(037)601248,2862,0,2020/09/15 21:44:46
5935050306,康利藥局,苗栗縣頭份市忠孝里仁愛路８６號,苗栗縣頭份市忠孝里仁愛路86號,24.6866262,120.9089223,(037)666101,3487,0,2020/09/15 21:44:46
5935051545,富優藥局,苗栗縣頭份市中華路９３０號,苗栗縣頭份市中華路930號,24.6860032,120.9076826,(037)681635,4113,1380,2020/09/15 21:44:46
5935051616,康寧藥局,苗栗縣頭份市和平路８０號一樓,苗栗縣頭份和平路80號一樓,24.6855629,120.9067893,(037)594173,3600,430,2020/09/15 21:44:46
5935051689,怡安藥局,苗栗縣頭份市自強路１０３號,苗栗縣頭份市自強路103號,24.6882093,120.9091943,(037)592093,3147,328,2020/09/15 21:44:46
5935051698,信源藥局,苗栗縣頭份市仁愛里信東路３９號,苗栗縣頭份市仁愛里信東路39號,24.6864193,120.9116349,(037)663580,4448,343,2020/09/15 21:44:46
5935051705,博士生活藥局,苗栗縣頭份市中華路１０４５號,苗栗縣頭份市中華路1045號,24.6865975,120.9083467,(037)598915,2358,1208,2020/09/15 21:44:46
5935051732,祐康藥局,苗栗縣頭份市自強路３７號,苗栗縣頭份市自強路37號,24.6894684,120.9114787,(037)663079,1541,1397,2020/09/15 21:44:46
5935051849,懷生中西藥局,苗栗縣頭份市中正路１９號,苗栗縣頭份市中正路19號,24.6843451,120.906842,(037)672357,3978,0,2020/09/15 21:44:46
5935051858,樂田藥妝藥局,苗栗縣頭份市信東路１３５號,苗栗縣頭份市信東路135號,24.68917,120.909359,(037)598995,1915,80,2020/09/15 21:44:46
5935051867,惠祐藥局,苗栗縣頭份市中正路１６５號,苗栗縣頭份市中正路165號,24.686892,120.910165,(037)668933,3825,100,2020/09/15 21:44:46
5935051885,安馨藥局,苗栗縣頭份市自強里１２鄰信東路１０６號,苗栗縣頭份市自強里12鄰信東路106號,24.6892384,120.9097803,(037)688156,1935,800,2020/09/15 21:44:46
5935051894,啊囉哈藥局,苗栗縣頭份市建國路二段１８０號,苗栗縣頭份市建國路二段180號,24.6962767,120.9024115,(037)666955,3060,440,2020/09/15 21:44:46
5935051929,仁方藥局,苗栗縣頭份市自強路１５０巷２－５號１樓,苗栗縣頭份市自強路150巷2-5號1樓,24.6878482,120.9069713,(037)687238,1809,0,2020/09/15 21:44:46
5935051938,吉品藥局,苗栗縣頭份市中正路９號,苗栗縣頭份市中正路9號,24.684378,120.906484,(037)676898,5098,0,2020/09/15 21:44:46
5935051947,森品藥局,苗栗縣頭份市建國路２段１５０、１５２、１５６號,苗栗縣頭份市建國路2段150、152、156號,24.6965056,120.9031426,(037)672378,2385,0,2020/09/15 21:44:46
5935051956,懷恩中西藥局,苗栗縣頭份市建國路１２８號,苗栗縣頭份市建國路128號,24.6958477,120.9098715,(037)683981,3308,330,2020/09/15 21:44:46
5935060053,鴻輝大藥局,苗栗縣後龍鎮北龍里中華路６４－１號,苗栗縣後龍鎮北龍里中華路64-1號,24.6156321,120.7879816,(037)721952,5391,810,2020/09/15 21:44:46
5935061407,佑安藥局,苗栗縣後龍鎮大庄里中山路１２５號,苗栗縣後龍鎮大庄里中山路125號,24.6137601,120.791271,(037)773066,1499,1190,2020/09/15 21:44:46
5935061425,懷信中西藥局,苗栗縣後龍鎮中山路１０３號,苗栗縣後龍鎮中山路103號,24.6141473,120.7906279,(037)724618,2534,2,2020/09/15 21:44:46
5935061434,千江大藥局,苗栗縣後龍鎮忠孝路５９號,苗栗縣後龍鎮忠孝路59號,24.6129231,120.791307,(037)037728208,1170,170,2020/09/15 21:44:46
5935061443,後龍藥局,苗栗縣後龍鎮中山路２０９號１，２樓,"苗栗縣後龍鎮中山路209號1,2樓",24.6127111,120.7933386,(037)723660,3222,590,2020/09/15 21:44:46
5935070022,林大藥局,苗栗縣卓蘭鎮新榮里中正路３２號,苗栗縣卓蘭鎮新榮里中正路32號,24.3107886,120.8254592,(04)25891630,1105,814,2020/09/15 21:44:46
5935071172,健安藥局,苗栗縣卓蘭鎮上新里上新七之１１號,苗栗縣卓蘭鎮上新里上新七之11號,24.3111261,120.8278088,(04)25899617,14,0,2020/09/15 21:44:46
5935071216,萊恩藥局,苗栗縣卓蘭鎮上新里上新7之1號,苗栗縣卓蘭鎮上新里上新7之1號,24.307011,120.830146,(04)25899369,269,1352,2020/09/15 21:44:46
5935071234,國良藥局,苗栗縣卓蘭鎮中山路１１１號,苗栗縣卓蘭鎮中山路111號,24.3121005,120.8259072,(04)25899578,501,848,2020/09/15 21:44:46
5935071243,卓蘭千百岳大藥局,苗栗縣卓蘭鎮中山路８２號,苗栗縣卓蘭鎮中山路82號,24.3121582,120.8262601,(04)25895473,4072,249,2020/09/15 21:44:46
5935080055,臺健中西藥局,苗栗縣大湖鄉中正路１９號,苗栗縣大湖鄉中正路19號,24.4216508,120.8689931,(037)990638,828,1346,2020/09/15 21:44:46
5935081123,景元藥局,苗栗縣大湖鄉中正路９７號,苗栗縣大湖鄉中正路97號,24.4226587,120.8663823,(037)996465,4113,1380,2020/09/15 21:44:46
5935081132,康城藥局,苗栗縣大湖鄉民生路６９號,苗栗縣大湖鄉民生路69號,24.4240831,120.8672214,(037)995188,3604,1280,2020/09/15 21:44:46
5935090015,永信藥局,苗栗縣公館鄉館中村榮光街１６號,苗栗縣公館鄉館中村榮光街16號,24.5022827,120.8269949,(037)223597,2763,720,2020/09/15 21:44:46
5935091156,信安藥局,苗栗縣公館鄉大同路７８號,苗栗縣公館鄉大同路78號,24.5002316,120.8280723,(037)237849,4096,542,2020/09/15 21:44:46
5935091245,芳鄰藥局,苗栗縣公館鄉玉泉村玉泉３６８之１１號,苗栗縣公館鄉玉泉村玉泉368之11號,24.5074834,120.8266584,(037)223727,4680,1187,2020/09/15 21:44:46
5935091254,上恩藥局,苗栗縣公館鄉大同路１８０號,苗栗縣公館鄉大同路180號,24.5024649,120.8283411,(037)234008,2166,332,2020/09/15 21:44:46
5935091263,懷慶中西藥局,苗栗縣公館鄉近光路９４號,苗栗縣公館鄉近光路94號,24.5032286,120.8273812,(037)239234,2773,1700,2020/09/15 21:44:46
5935091272,杏中藥局,苗栗縣公館鄉館東村５鄰大同路１７４號,苗栗縣公館鄉館東村5鄰大同路174號,24.5023556,120.8283289,(037)232611,4158,640,2020/09/15 21:44:46
5935100025,仁興藥局,苗栗縣銅鑼鄉銅鑼村中正路９７號,苗栗縣銅鑼鄉銅鑼村中正路97號,24.486024,120.786809,(037)983792,3555,30,2020/09/15 21:44:46
5935120027,裕祥藥局,苗栗縣頭屋鄉頭屋村尖豐路８５號,苗栗縣頭屋鄉頭屋村尖豐路85號,24.575226,120.852215,(037)253553,4441,1632,2020/09/15 21:44:46
5935130023,民享藥局,苗栗縣三義鄉廣盛村中正路１４７之３號,苗栗縣三義鄉廣盛村中正路147之3號,24.4129583,120.7718575,(037)871498,6447,740,2020/09/15 21:44:46
5935131075,安康藥局,苗栗縣三義鄉廣盛中正路114號,苗栗縣三義鄉廣盛中正路114號,24.413729,120.771979,(037)875958,4626,230,2020/09/15 21:44:46
5935141044,一心藥局,苗栗縣西湖鄉三湖村店仔街４２號,苗栗縣西湖鄉三湖村店仔街42號,24.557944,120.7573554,(037)920868,3282,1247,2020/09/15 21:44:46
5935160012,東南藥局,苗栗縣三灣鄉銅鏡村通過寮１５號,苗栗縣三灣鄉銅鏡村通過寮15號,24.667248,120.974749,(037)834275,1548,990,2020/09/15 21:44:46
5936010020,合裕藥局,臺中縣豐原市三村里合作街９６–１號,臺中市豐原區合作街96–1號,24.2396542,120.708043,(04)5296085,765,1060,2020/09/15 21:44:46
5936010057,慈安藥局,臺中市豐原區西湳里豐北街４０３號,台中市豐原區西湳里豐北街403號,24.259117,120.713997,(04)25236680,4944,10,2020/09/15 21:44:46
5936010146,信惠藥局,臺中市豐原區豐田里田心路二段２２５號,台中市豐原區豐田里田心路二段225號,24.2367822,120.7217947,(04)25263861,1885,0,2020/09/15 21:44:46
5936010155,春輝堂藥局,臺中市豐原區北陽里豐東路２２０巷１７號,台中市豐原區北陽里豐東路220巷17號,24.249395,120.732107,(04)25280086,1008,630,2020/09/15 21:44:46
5936010244,惠生藥局,臺中市豐原區社皮里中正路９１８號,台中市豐原區社皮里中正路918號,24.249296,120.699545,(04)25225760,2579,1411,2020/09/15 21:44:46
5936010280,快安藥局,臺中市豐原區三豐路一段２０５號,臺中市豐原區三豐路一段205號,24.2587653,120.7206216,(04)25228169,3717,554,2020/09/15 21:44:46
5936010379,瑞輝藥局,臺中市豐原區西勢里西安街５６號,台中市豐原區西勢里西安街56號,24.2494959,120.713511,(04)25262821,3159,370,2020/09/15 21:44:46
5936010422,謝藥局,臺中市豐原區葫蘆里市前街２３號,台中市豐原區葫蘆里市前街23號,24.248946,120.715453,(04)25221812,4522,1112,2020/09/15 21:44:46
5936010486,輝生藥局,臺中市豐原區鐮村路４１１號,台中市豐原區鐮村路411號,24.226947,120.724509,(04)25379563,2303,1250,2020/09/15 21:44:46
5936010628,協安大藥局,臺中市豐原區府前街６３號,台中市豐原區府前街63號,24.249508,120.7183685,(04)25200808,3255,650,2020/09/15 21:44:46
5936010780,復生藥局,臺中市豐原區田心路２段２６９號,台中市豐原區田心路2段269號,24.2382149,120.722667,(04)25261803,4068,500,2020/09/15 21:44:46
5936010815,國安保健藥局,臺中市豐原區豐田里田心路二段２５８號,台中市豐原區豐田里田心路二段258號,24.237955,120.7220264,(04)25261726,2601,0,2020/09/15 21:44:46
5936010888,惠笙大藥局,臺中市豐原區三民路１８０號,台中市豐原區三民路180號,24.253554,120.718334,(04)25279912,4388,215,2020/09/15 21:44:46
5936012088,安效藥局,臺中市豐原區西安里西勢路１１４巷３２號,台中市豐原區西安里西勢路114巷32號,24.2454678,120.7073713,(04)25269086,3391,757,2020/09/15 21:44:46
5936012097,林芳泉藥局,臺中市豐原區中正路二二八號,台中市豐原區中正路二二八號,24.25211,120.717223,(04)25222308,1212,1085,2020/09/15 21:44:46
5936012113,錦堂藥局,臺中市豐原區中正路１０６號,台中市豐原區中正路106號,24.252133,120.720651,(04)25229969,4677,1710,2020/09/15 21:44:46
5936012131,聖得藥局,臺中市豐原區中正路７０號,台中市豐原區中正路70號,24.252814,120.721336,(04)25158649,4891,717,2020/09/15 21:44:46
5936012140,美日藥局,臺中市豐原區三民路１８８號１樓,臺中市豐原區三民路188號1樓,24.253481,120.718135,(04)25228490,2070,70,2020/09/15 21:44:46
5936012177,橘井藥局,臺中市豐原區中正路４２３號,台中市豐原區中正路423號,24.250533,120.712406,(04)25285948,1310,890,2020/09/15 21:44:46
5936012275,瑞康藥局,臺中市豐原區中正路２７４號,臺中市豐原區中正路274號,24.251836,120.716001,(04)25287368,2556,886,2020/09/15 21:44:46
5936012337,恆安大藥局,臺中市豐原區忠孝街４６號,台中市豐原區忠孝街46號,24.2527701,120.7167091,(04)25226700,3874,0,2020/09/15 21:44:46
5936012435,臺安保健藥局,臺中市豐原區三民路３４號,台中市豐原區三民路34號,24.254155,120.722143,(04)25280098,0,328,2020/09/15 21:44:46
5936012515,中正藥局,臺中市豐原區中正路１８６號,台中市豐原區中正路186號,24.251918,120.718624,(04)25298379,4818,930,2020/09/15 21:44:46
5936012551,豐原福倫藥局,臺中市豐原區中正路２９６號,台中市豐原區中正路296號,24.2515168,120.7152028,(04)25276618,37668,3,2020/09/15 21:44:46
5936012560,進安藥局,臺中市豐原區西勢路１１５號,台中市豐原區西勢路115號,24.2452161,120.7085218,(04)25262681,4203,0,2020/09/15 21:44:46
5936012659,信安藥局,臺中市豐原區三豐路二段３７號,臺中市豐原區三豐路二段37號,24.2643229,120.7200969,(04)25248736,5575,0,2020/09/15 21:44:46
5936012677,誠品藥局,臺中市豐原區中山路３４９號,台中市豐原區中山路349號,24.2491149,120.7148545,(04)25120495,3347,1233,2020/09/15 21:44:46
5936020017,郭藥局,臺中市東勢區南平里豐勢路３９４號,台中市東勢區南平里豐勢路394號,24.2549271,120.8294465,(04)25883382,648,1320,2020/09/15 21:44:46
5936020035,劉藥局,臺中市東勢區東安里豐勢路４７６號,台中市東勢區東安里豐勢路476號,24.2569259,120.8285322,(04)25873198,2754,921,2020/09/15 21:44:46
5936020053,生生藥局,臺中市東勢區延平里豊勢路２８２號,台中市東勢區延平里豊勢路282號,24.252294,120.8300383,(04)25875187,394,1368,2020/09/15 21:44:46
5936020080,仁生藥局,臺中市東勢區東安里豐勢路４２１號,台中市東勢區東安里豐勢路421號,24.256448,120.8285585,(04)25872245,3645,160,2020/09/15 21:44:46
5936020099,益春藥局,臺中市東勢區南平里三民路１３７號,台中市東勢區南平里三民路137號,24.2540877,120.827641,(04)25878730,2079,1452,2020/09/15 21:44:46
5936020115,東生藥局,臺中市東勢區中寧里豐勢路４９１號,台中市東勢區中寧里豐勢路491號,24.2580701,120.8278453,(04)25873647,3609,1060,2020/09/15 21:44:46
5936020133,永和藥局,臺中市東勢區本街275號,台中市東勢區本街275號,24.2564401,120.8277476,(04)25884023,4693,680,2020/09/15 21:44:46
5936020142,新明通藥局,臺中市東勢區延平里豐勢路２３２號,台中市東勢區延平里豐勢路232號,24.251098,120.830352,(04)25873969,2623,855,2020/09/15 21:44:46
5936020204,健生藥局,臺中市東勢區東崎路５段４０９號,臺中市東勢區東崎路5段409號,24.2511782,120.8325096,(04)25871401,2574,630,2020/09/15 21:44:46
5936021327,千百岳大藥局,臺中市東勢區豐勢路８５號１樓,臺中市東勢區豐勢路85號1樓,24.2488914,120.8311281,(04)25887639,4046,1220,2020/09/15 21:44:46
5936021363,小太陽藥局,臺中市東勢區豐勢路４１２之１、４１６號１樓,臺中市東勢區豐勢路412之1、416號1樓,24.2552092,120.829314,(04)25773481,2592,160,2020/09/15 21:44:46
5936030077,健聖藥局,臺中市大甲區孟春里通天路２２７號,台中市大甲區孟春里通天路227號,24.381408,120.653551,(04)26813292,2225,529,2020/09/15 21:44:46
5936030095,青三藥局,臺中市大甲區青三路１２巷３８號,台中市大甲區青三路12巷38號,24.4063079,120.6472917,(04)26817301,5274,55,2020/09/15 21:44:46
5936030479,上慧藥局,臺中市大甲區順天路３４２號,台中市大甲區順天路342號,24.350165,120.627062,(04)26873515,2943,539,2020/09/15 21:44:46
5936031574,安新藥局,臺中市大甲區順天路３８５號,台中市大甲區順天路385號,24.3501304,120.6267606,(04)26764686,1147,897,2020/09/15 21:44:46
5936031609,金鼎藥局,臺中市大甲區文武路６７號,台中市大甲區文武路67號,24.3470736,120.6232987,(04)26805312,3078,1000,2020/09/15 21:44:46
5936031707,大甲福倫藥局,臺中市大甲區蔣公路２０２號,台中市大甲區蔣公路202號,24.346813,120.620691,(04)26765518,5148,590,2020/09/15 21:44:46
5936040117,中央藥局,臺中市清水區鎮北街５６號,台中市清水區鎮北街56號,24.268522,120.576236,(04)26222176,108,4,2020/09/15 21:44:46
5936040135,德厚藥局,臺中市清水區慷榔里慷榔２街５０號,台中市清水區慷榔里慷榔2街50號,24.2641787,120.5473619,(04)26560733,1073,0,2020/09/15 21:44:46
5936040171,親民大藥局,臺中市清水區鎮北街６１號,台中市清水區鎮北街61號,24.2687889,120.574692,(04)26226012,1215,50,2020/09/15 21:44:46
5936041249,清水藥局,臺中市清水區文昌街２９號１樓,臺中市清水區文昌街29號1樓,24.2698412,120.5765587,(04)26221425,5050,5,2020/09/15 21:44:46
5936050060,大原藥局,臺中市沙鹿區洛泉里四平街１４２號,台中市沙鹿區洛泉里四平街142號,24.236463,120.560831,(04)26626572,5,24,2020/09/15 21:44:46
5936050239,信輝藥局,臺中市沙鹿區美仁里沙田路１４１號,台中市沙鹿區美仁里沙田路141號,24.236344,120.559191,(04)26622135,4659,4,2020/09/15 21:44:46
5936050248,濟生一藥局,臺中市沙鹿區沙田路１４６號,台中市沙鹿區沙田路146號,24.2365447,120.5596599,(04)26626826,1593,590,2020/09/15 21:44:46
5936050364,沙鹿福倫藥局,臺中市沙鹿區鹿寮里中山路４１７－５號,台中市沙鹿區鹿寮里中山路417–5號,24.242318,120.560962,(04)26657718,3951,40,2020/09/15 21:44:46
5936051389,康裕藥局,臺中市沙鹿區中山路２８０號１樓,台中市沙鹿區中山路280號1樓,24.2382631,120.5603482,(04)26633758,853,0,2020/09/15 21:44:46
5936051432,日新藥局,臺中市沙鹿區日新街１１７號,台中市沙鹿區日新街117號,24.2370939,120.5598293,(04)26633100,3312,540,2020/09/15 21:44:46
5936051441,永富藥局,臺中市沙鹿區中山路２８６號,台中市沙鹿區中山路286號,24.238444,120.5601282,(04)26625339,1854,40,2020/09/15 21:44:46
5936051450,慈愛藥師藥局,臺中市沙鹿區大同街３６－４號１樓,台中市沙鹿區大同街36-4號1樓,24.2353078,120.5580624,(04)26623360,2468,1592,2020/09/15 21:44:46
5936051478,佑安藥局,臺中市沙鹿區中山路３４６號,台中市沙鹿區中山路346號,24.240522,120.560787,(04)26632798,3419,979,2020/09/15 21:44:46
5936060137,南昌藥局,臺中縣梧棲鎮南簡里中央路二段４６５號１樓,臺中市梧棲區中央路二段465號,24.2610166,120.5429186,(04)26565073,4194,120,2020/09/15 21:44:46
5936060164,中港藥局,臺中市梧棲區臺灣大道八段７６６號,臺中市梧棲區臺灣大道八段766號,24.2480607,120.5424031,(04)26565360,1578,249,2020/09/15 21:44:46
5936061269,友達藥局,臺中市梧棲區中央路１段８５９號,台中市梧棲區中央路1段859號,24.2468343,120.5378369,(04)26567871,1287,62,2020/09/15 21:44:46
5936070017,富大藥局,臺中市后里區甲后路１段４３８號,台中市后里區甲后路1段438號,24.308791,120.7227505,(04)25568578,4464,970,2020/09/15 21:44:46
5936070053,則安藥局,臺中市后里區三豐路四段１８號,臺中市后里區三豐路四段18號,24.309241,120.7226287,(04)25562835,3776,1946,2020/09/15 21:44:46
5936070124,福美藥局,臺中市后里區墩北村四村路１０３號,台中市后里區墩北村四村路103號,24.3054863,120.7130774,(04)25562058,3464,0,2020/09/15 21:44:46
5936071158,保仁藥局,臺中市后里區甲后路一段５８５號,臺中市后里區甲后路一段585號,24.3093028,120.7191759,(04)25573342,3689,1214,2020/09/15 21:44:46
5936071185,后里東亞大藥局,臺中市后里區民生路１２３號,台中市后里區民生路123號,24.307049,120.716339,(04)25570225,2921,0,2020/09/15 21:44:46
5936080068,德惠藥局,臺中市神岡區岸裡里豐社一街３０號,台中市神岡區岸裡里豐社一街30號,24.24963,120.6985278,(04)25227548,270,590,2020/09/15 21:44:46
5936081172,民翔藥局,臺中市神岡區昌平路５段４８０號,臺中市神岡區昌平路5段480號,24.2462716,120.6850313,(04)25633323,3349,1,2020/09/15 21:44:46
5936090037,皇杰藥局,臺中市潭子區潭興路２段４２９號,台中市潭子區潭興路2段429號,24.2107469,120.708268,(04)25367109,1584,0,2020/09/15 21:44:46
5936090126,頭張藥局,臺中市潭子區頭張路一段１０８號,台中市潭子區頭張路一段108號,24.1945358,120.6998268,(04)25334510,2408,29,2020/09/15 21:44:46
5936090144,宏仁藥局,臺中市潭子區潭陽里潭子街２段８號,台中市潭子區潭陽里潭子街2段8號,24.2099611,120.7058457,(04)25367266,5173,30,2020/09/15 21:44:46
5936090171,信源藥局,臺中市潭子區潭北里潭子街三段３９號,台中市潭子區潭北里潭子街三段39號,24.2142995,120.7067163,(04)25367233,4599,0,2020/09/15 21:44:46
5936091301,廣泰藥局,臺中市潭子區福仁里復興路一段二二號,台中市潭子區福仁里復興路一段二二號,24.2019705,120.7060025,(04)25392620,4995,520,2020/09/15 21:44:46
5936091427,久祥藥局,臺中市潭子區中山路二段３８４之７號,台中市潭子區中山路二段384之7號,24.2142321,120.7053674,(04)25325519,1898,1440,2020/09/15 21:44:46
5936091472,豐全藥局,臺中市潭子區甘蔗里雅潭路一段一六一號,台中市潭子區甘蔗里雅潭路一段一六一號,24.2160352,120.7010513,(04)25322350,3575,397,2020/09/15 21:44:46
