醫事機構代碼,醫事機構名稱,醫事機構地址,address_clean,latitude,longitude,醫事機構電話,成人口罩剩餘數,兒童口罩剩餘數,來源資料時間
5903230156,樂業小林健保藥局,臺中市東區樂業路４４３號１樓,臺中市東區樂業路443號1樓,24.1369323,120.7062445,(04)22139123,781,1810,2020/09/15 21:44:46
5903230165,快安堂藥局,臺中市東區旱溪街８０之１１號,臺中市東區旱溪街80之11號,24.1405156,120.6948211,(04)22115983,2956,1312,2020/09/15 21:44:46
5903230183,恒生藥局,臺中市東區樂業路３９５號１樓,臺中市東區樂業路395號1樓,24.1379601,120.7052579,(04)22135179,1944,914,2020/09/15 21:44:46
5903240090,嶸曜藥局,臺中市西區美村路１段５９２號,臺中市西區美村路1段592號,24.134337,120.661895,(04)23782478,2563,0,2020/09/15 21:44:46
5903240143,利民藥局,臺中市西區四維街２３號１樓,臺中市西區四維街23號1樓,24.1371348,120.6759079,(04)22292931,1917,1170,2020/09/15 21:44:46
5903240170,美村全成藥局,臺中市西區美村路１段２２２號１樓,臺中市西區美村路1段222號1樓,24.148767,120.661407,(04)23014006,1841,1040,2020/09/15 21:44:46
5903240198,鑫祐藥局,臺中市西區民權路３０２－５號,臺中市西區民權路302-5號,24.147511,120.670123,(04)23027778,5148,5799,2020/09/15 21:44:46
5903240205,捷登藥局,臺中市西區公益路１０６號,臺中市西區公益路106號,24.1511389,120.661298,(04)23191929,1241,793,2020/09/15 21:44:46
5903240278,美術藥局,臺中市西區美村路一段５６７號,臺中市西區美村路一段567號,24.1394089,120.6618278,(04)23725286,2722,949,2020/09/15 21:44:46
5903240287,美村大藥局,臺中市西區美村路一段６２號１樓,臺中市西區美村路一段62號1樓,24.152998,120.661389,(04)23288121,3661,1257,2020/09/15 21:44:46
5903240358,早齋藥局,臺中市西區美村路一段３４２號１樓,臺中市西區美村路一段342號1樓,24.1453719,120.6615094,(04)23029168,4952,429,2020/09/15 21:44:46
5903240367,宇祥藥局,臺中市西區五權五街１１９號１樓,臺中市西區五權五街119號1樓,24.1363924,120.6600734,(04)23728239,1836,910,2020/09/15 21:44:46
5903240376,台丞藥局,臺中市西區三民路一段１６６－５號,臺中市西區三民路一段166-5號,24.1375156,120.6746553,(04)22279666,0,290,2020/09/15 21:44:46
5903240385,喆星藥局,臺中市西區精誠路４２２號,臺中市西區精誠路422號,24.1451596,120.6550356,(04)24715301,2482,331,2020/09/15 21:44:46
5903240410,德芳美村藥局,臺中市西區美村路一段６８１、６８３號１樓,臺中市西區美村路一段681、683號1樓,24.1354712,120.6618148,(04)23782848,1062,1140,2020/09/15 21:44:46
5903240429,神農藥局,臺中市西區公益路１９０之１號１樓,臺中市西區公益路190之1號1樓,24.1510301,120.6566458,(04)23103335,3449,1428,2020/09/15 21:44:46
5903250041,小林健保藥局,臺中市南區美村路２段１８２號,臺中市南區美村路2段182號,24.125447,120.663068,(04)22622099,3834,39,2020/09/15 21:44:46
5903250069,尚尚藥局,臺中市南區美村南路１９７號１樓,臺中市南區美村南路197號1樓,24.1151899,120.666575,(04)22606831,355,0,2020/09/15 21:44:46
5903250103,忠孝德侑健保藥局,臺中市南區正義街１５９號,臺中市南區正義街159號,24.1288908,120.6807846,(04)22851400,4583,1658,2020/09/15 21:44:46
5903250112,立成藥局,臺中市南區學府路１４３號,臺中市南區學府路143號,24.1290152,120.6739278,(04)22205915,4197,294,2020/09/15 21:44:46
5903250176,弘大美妝藥局,臺中市南區南門路１１５號１樓,臺中市南區南門路115號1樓,24.122274,120.679994,(04)22859180,1642,1437,2020/09/15 21:44:46
5903250194,元氣家藥局,臺中市南區文心南路８８８－３號１樓,臺中市南區文心南路888-3號1樓,24.1114669,120.6596042,(04)22631660,25,985,2020/09/15 21:44:46
5903250274,明心健康藥局,臺中市南區三民西路３７５號１樓,臺中市南區三民西路375號1樓,24.1293656,120.655544,(04)23780170,4580,409,2020/09/15 21:44:46
5903250309,台杏藥局,臺中市南區復興路三段３３７號,臺中市南區復興路三段337號,24.1326699,120.677947,(04)22218087,4398,1460,2020/09/15 21:44:46
5903250318,全太藥局,臺中市南區復興路一段４４７號,臺中市南區復興路一段447號,24.1170055,120.6573271,(04)22600068,3096,40,2020/09/15 21:44:46
5903250381,大樹美村藥局,臺中市南區美村南路１２４號,臺中市南區美村南路124號,24.11499,120.667012,(04)22621113,4068,0,2020/09/15 21:44:46
5903250425,鴻源藥局,臺中市南區德富路９號１樓,臺中市南區德富路9號1樓,24.1214495,120.6531842,(04)22655436,1184,732,2020/09/15 21:44:46
5903250434,仁美藥局,臺中市南區南平路１６９號,臺中市南區南平路169號,24.1234095,120.6653404,(04)22652495,3663,980,2020/09/15 21:44:46
5903250443,千美台安藥局,臺中市南區美村南路２６３號,臺中市南區美村南路263號,24.1142899,120.666598,(04)22602101,12602,1617,2020/09/15 21:44:46
5903250498,田園藥局,臺中市南區學府路１６０號１樓,臺中市南區學府路160號1樓,24.129143,120.674204,(04)22220605,0,10,2020/09/15 21:44:46
5903250505,心安藥局,臺中市南區國光路２４１號１樓,臺中市南區國光路241號1樓,24.126813,120.679299,(04)22858773,3,1022,2020/09/15 21:44:46
5903250514,泰友藥局,臺中市南區復興路二段９９巷１３號１樓,臺中市南區復興路二段99巷13號1樓,24.1240382,120.662636,(04)22615701,1504,1003,2020/09/15 21:44:46
5903250523,長榮藥局,臺中市南區新華街１８６號１樓,臺中市南區新華街186號1樓,24.1296558,120.6721205,(04)22220210,3753,250,2020/09/15 21:44:46
5903260163,康甫藥師藥局,臺中市北區進化北路３６６號１樓,臺中市北區進化北路366號1樓,24.1632954,120.6806604,(04)22366682,1632,0,2020/09/15 21:44:46
5903260270,冠安藥局,臺中市北區進化路５１０、５１２號,臺中市北區進化路510、512號,24.1582552,120.694559,(04)22335770,4059,275,2020/09/15 21:44:46
5903260314,喜悅健保藥局,臺中市北區健行路４１４號１樓,臺中市北區健行路414號1樓,24.159321,120.681813,(04)22333988,5683,2587,2020/09/15 21:44:46
5903260341,台中漢口藥局,臺中市北區漢口路３段１８３號,臺中市北區漢口路3段183號,24.16713,120.671116,(04)22936166,2865,635,2020/09/15 21:44:46
5903260350,宏信藥局,臺中市北區崇德路１段４５３號,臺中市北區崇德路1段453號,24.1632688,120.6846791,(04)22355476,0,760,2020/09/15 21:44:46
5903260387,台中大樹藥局,臺中市北區漢口路３段２６１號,臺中市北區漢口路3段261號,24.1670139,120.672714,(04)22981113,4896,469,2020/09/15 21:44:46
5903260421,忠明小林健保藥局,臺中市北區忠明路１６１號,臺中市北區忠明路161號,24.1624073,120.6641681,(04)22013666,5616,407,2020/09/15 21:44:46
5903260476,康媞藥局,臺中市北區山西路二段１２５號,臺中市北區山西路二段125號,24.1716722,120.6758005,(04)22925388,2403,590,2020/09/15 21:44:46
5903260501,瑞鋒藥師藥局,臺中市北區育德路１６號,臺中市北區育德路16號,24.157695,120.679517,(04)22020786,0,1110,2020/09/15 21:44:46
5903260529,多倫多藥局,臺中市北區太原路二段１１號１樓,臺中市北區太原路二段11號1樓,24.1653996,120.6742243,(04)22980210,14697,1260,2020/09/15 21:44:46
5903260547,源順大藥局,臺中市北區健行路４８４號,臺中市北區健行路484號,24.1593569,120.679653,(04)22072651,3682,1356,2020/09/15 21:44:46
5903260592,台中丁丁藥局,臺中市北區漢口路４段２５５號,臺中市北區漢口路4段255號,24.16728,120.679435,(04)22374596,3636,290,2020/09/15 21:44:46
5903260618,中清小林健保藥局,臺中市北區中清路一段８６、８８號１樓,臺中市北區中清路一段86、88號1樓,24.1530881,120.6774954,(04)22034197,1731,1262,2020/09/15 21:44:46
5903260627,明曜藥局,臺中市北區北平路二段１９０號１樓,臺中市北區北平路二段190號1樓,24.171173,120.678402,(04)22916775,2685,1102,2020/09/15 21:44:46
5903260636,進化瑞昌藥局,臺中市北區進化路３３２號,臺中市北區進化路332號,24.153817,120.6946276,(04)23608199,1143,1120,2020/09/15 21:44:46
5903260663,佑全台中五權藥局,臺中市北區五權路４９６號,臺中市北區五權路496號,24.1532941,120.6832659,(04)22080702,4834,1323,2020/09/15 21:44:46
5903260681,昭德藥師藥局,臺中市北區西屯路一段３４５號,臺中市北區西屯路一段345號,24.1600734,120.6654428,(04)23235655,1539,1210,2020/09/15 21:44:46
5903260734,立得藥局,臺中市北區忠太西路１１號１樓,臺中市北區忠太西路11號1樓,24.1599908,120.6677564,(04)22080013,5598,950,2020/09/15 21:44:46
5903260743,黎明安德藥局,臺中市北區中清路１段８５２號１樓,臺中市北區中清路1段852號1樓,24.1515603,120.6771338,(04)22956098,4491,1230,2020/09/15 21:44:46
5903260752,躍獅達心藥局,臺中市北區雙十路二段１８７號１樓,臺中市北區雙十路二段187號1樓,24.1578439,120.690605,(04)22344548,1038,0,2020/09/15 21:44:46
5903260761,杏一北區忠明藥局,臺中市北區忠明路４４２號１樓,臺中市北區忠明路442號1樓,24.1626369,120.670252,(04)22081273,8765,2221,2020/09/15 21:44:46
5903260789,瑞昌藥局,臺中市北區學士路１５５號１樓,臺中市北區學士路155號1樓,24.158414,120.680746,(04)22056819,2331,750,2020/09/15 21:44:46
5903260798,光恒藥局,臺中市北區五權路２６１號１樓,臺中市北區五權路261號1樓,24.1513591,120.6769928,(04)22068638,1512,1040,2020/09/15 21:44:46
5903260814,杏一北區文心藥局,臺中市北區文心路４段２１０－８號１、２樓,臺中市北區文心路4段210-8號1、2樓,24.1729482,120.6779967,22993847,4920,650,2020/09/15 21:44:46
5903270025,祐生藥局,臺中市西屯區文華路３之１號１樓,臺中市西屯區文華路3之1號1樓,24.179397,120.646409,(04)24517169,438,1074,2020/09/15 21:44:46
5903270061,青育藥師藥局,臺中市西屯區河南路２段３６２號１樓,臺中市西屯區河南路2段362號1樓,24.1736841,120.6469885,(04)27068798,2134,793,2020/09/15 21:44:46
5903270089,信心藥局,臺中市西屯區四川路１９０號,臺中市西屯區四川路190號,24.1604541,120.6557821,(04)23163430,2315,821,2020/09/15 21:44:46
5903270105,樂得好大藥局,臺中市西屯區上石路２號１樓,臺中市西屯區上石路2號1樓,24.1668986,120.6434234,(04)24521173,3243,1015,2020/09/15 21:44:46
5903270230,大心藥局,臺中市西屯區西屯路２段２９５－１９號,臺中市西屯區西屯路2段295-19號,24.1779928,120.6418633,(04)24528355,2835,1180,2020/09/15 21:44:46
5903270301,宥承藥局,臺中市西屯區西屯路３段１４８－１６號,臺中市西屯區西屯路3段148-16號,24.185631,120.624214,(04)24626559,3416,684,2020/09/15 21:44:46
5903270310,弘福藥師藥局,臺中市西屯區西屯路３段１６６－２１號１樓,臺中市西屯區西屯路3段166-21號1樓,24.1891669,120.6158092,(04)24611916,3591,1200,2020/09/15 21:44:46
5903270347,甘肅安德藥局,臺中市西屯區甘肅路２０２－３號,臺中市西屯區甘肅路202-3號,24.1683465,120.6572885,(04)23165935,2250,0,2020/09/15 21:44:46
5903270365,麒霖藥局,臺中市西屯區福順路３０７號１樓,臺中市西屯區福順路307號1樓,24.1832398,120.6185336,(04)24638978,3101,850,2020/09/15 21:44:46
5903270383,佳德健保藥局,臺中市西屯區工業３８路２６號,臺中市西屯區工業38路26號,24.1760679,120.5895755,(04)23598285,4434,316,2020/09/15 21:44:46
5903270392,瑞德大藥局,臺中市西屯區中清西二街８４號,臺中市西屯區中清西二街84號,24.175124,120.667151,(04)22939820,7141,1719,2020/09/15 21:44:46
5903270409,維恩藥局,臺中市西屯區甘肅路一段１９５號,臺中市西屯區甘肅路一段195號,24.1685094,120.6568794,(04)23174277,5042,810,2020/09/15 21:44:46
5903270516,中科何藥局,臺中市西屯區福康路４０號,臺中市西屯區福康路40號,24.1842301,120.6171694,(04)24612570,4005,0,2020/09/15 21:44:46
5903270552,瑞心藥局,臺中市西屯區福科路９５０號,臺中市西屯區福科路950號,24.1876098,120.6059157,(04)24639203,3015,1040,2020/09/15 21:44:46
5903270570,百富藥局,臺中市西屯區福上巷１６號,臺中市西屯區福上巷16號,24.176188,120.6610112,(04)22970708,1468,1007,2020/09/15 21:44:46
5903270598,瑞晟中西藥局,臺中市西屯區大信街５０－１號,臺中市西屯區大信街50-1號,24.1654248,120.6613982,(04)23157228,1860,1016,2020/09/15 21:44:46
5903270605,樂芙藥局,臺中市西屯區大墩路８８１號１樓,臺中市西屯區大墩路881號1樓,24.156251,120.6500242,(04)23203100,927,681,2020/09/15 21:44:46
5903270614,至善德侑藥局,臺中市西屯區至善路６０號,臺中市西屯區至善路60號,24.171407,120.639564,(04)24518729,5580,320,2020/09/15 21:44:46
5903270678,增健美藥局,臺中市西屯區河南路２段３５９號１樓,臺中市西屯區河南路2段359號1樓,24.1717469,120.645068,(04)27056068,3333,1725,2020/09/15 21:44:46
5903270721,舒健藥局,臺中市西屯區西屯路二段２５５號２樓,臺中市西屯區西屯路二段255號2樓,24.1718512,120.6458599,(04)27077858,1357,1150,2020/09/15 21:44:46
5903270749,大墩藥局,臺中市西屯區大墩１９街６８號１樓,臺中市西屯區大墩19街68號1樓,24.1573372,120.6540371,(04)23209602,3663,650,2020/09/15 21:44:46
5903270776,河南丁丁藥局,臺中市西屯區河南路４段１９１號,臺中市西屯區河南路4段191號,24.1556511,120.6366706,(04)22511658,4689,0,2020/09/15 21:44:46
5903270801,榮友藥局,臺中市西屯區臺灣大道四段１７４２號,臺中市西屯區臺灣大道四段1742號,24.182964,120.6023197,(04)23508392,1273,607,2020/09/15 21:44:46
5903270810,佑全福星藥局,臺中市西屯區黎明路三段３９５、３９７號,臺中市西屯區黎明路三段395、397號,24.1828085,120.6390502,(04)24527465,1399,930,2020/09/15 21:44:46
5903270847,分子藥局,臺中市西屯區惠來路二段２３６－１號,臺中市西屯區惠來路二段236-1號,24.1632217,120.6420307,(04)22513080,0,370,2020/09/15 21:44:46
5903270865,尚禾藥局,臺中市西屯區青海路一段６５號,臺中市西屯區青海路一段65號,24.1643731,120.6547993,(04)23147688,3347,1280,2020/09/15 21:44:46
5903270874,熊健康藥局,臺中市西屯區太原路一段２３２號,臺中市西屯區太原路一段232號,24.163875,120.6631841,(04)23163505,7,1260,2020/09/15 21:44:46
5903270883,祥和大藥局,臺中市西屯區青海路二段２４０－９號,臺中市西屯區青海路二段240-9號,24.1704737,120.645496,(04)27000122,3279,0,2020/09/15 21:44:46
5903270892,杏林堂藥局,臺中市西屯區黎明路三段１４８號１樓,臺中市西屯區黎明路三段148號1樓,24.17729,120.637613,(04)24528967,1314,270,2020/09/15 21:44:46
5903270909,元生藥局,臺中市西屯區大墩路９６０號,臺中市西屯區大墩路960號,24.15817,120.6515849,(04)23274539,3906,1039,2020/09/15 21:44:46
5903270918,全成西屯藥局,臺中市西屯區黎明路三段２２１、２２３號1樓,臺中市西屯區黎明路三段221、223號1樓,24.1772475,120.6373592,(04)24512290,2610,710,2020/09/15 21:44:46
5903270927,河南小林健保藥局,臺中市西屯區河南路二段２９８號１樓,臺中市西屯區河南路二段298號1樓,24.1747836,120.6485122,(04)24512830,80,1257,2020/09/15 21:44:46
5903270936,新元藥局,臺中市西屯區文心路三段５３２號１樓,臺中市西屯區文心路三段532號1樓,24.1726709,120.665914,(04)23121383,11487,1176,2020/09/15 21:44:46
5903270963,源興大藥局,臺中市西屯區西屯路二段１２號,臺中市西屯區西屯路二段12號,24.1637493,120.6621015,(04)23143045,2274,941,2020/09/15 21:44:46
5903271004,西屯青育藥師藥局,臺中市西屯區西屯路二段２９５－３號１樓,臺中市西屯區西屯路二段295-3號1樓,24.1773858,120.6424526,(04)27077898,549,750,2020/09/15 21:44:46
5903271022,西屯藥局,臺中市西屯區西屯路三段１５０－４５號１樓,臺中市西屯區西屯路三段150-45號1樓,24.1869841,120.6208371,(04)24621822,2889,8,2020/09/15 21:44:46
5903271031,美十樂中科藥局,臺中市西屯區西屯路三段１６６－６５號１樓,臺中市西屯區西屯路三段166-65號1樓,24.1902744,120.6130281,(04)24610219,3682,0,2020/09/15 21:44:46
5903271040,美康逢甲健保藥局,臺中市西屯區福星路４３１號１樓、４３１－１號２樓,臺中市西屯區福星路431號1樓、431-1號2樓,24.178539,120.645498,(04)24528707,4815,1310,2020/09/15 21:44:46
5903271059,安德藥局,臺中市西屯區福康路１７號１樓,臺中市西屯區福康路17號1樓,24.183323,120.6166167,(04)24638302,2161,1328,2020/09/15 21:44:46
5903271068,西墩藥局,臺中市西屯區黎明路三段２７５、２７７號１樓,臺中市西屯區黎明路三段275、277號1樓,24.1782854,120.6374339,(04)24510770,7158,950,2020/09/15 21:44:46
5903271077,合和健保藥局,臺中市西屯區福科路７９３號１樓,臺中市西屯區福科路793號1樓,24.1870949,120.6086044,(04)24630321,1548,120,2020/09/15 21:44:46
5903271086,常春藤藥局,臺中市西屯區福康路８０號１樓,臺中市西屯區福康路80號1樓,24.1860743,120.6179779,(04)24619296,4160,424,2020/09/15 21:44:46
5903271102,杏東美藥局,臺中市西屯區智惠街１５６號１樓,臺中市西屯區智惠街156號1樓,24.170238,120.6437556,(04)24523798,3538,1333,2020/09/15 21:44:46
5903271111,西屯長安藥局,臺中市西屯區成都路３６８號１樓,臺中市西屯區成都路368號1樓,24.1732394,120.6640531,(04)22981221,2178,1250,2020/09/15 21:44:46
5903271120,合和健保藥局,臺中市西屯區福科路７９３號１樓,臺中市西屯區福科路793號1樓,24.1870949,120.6086044,(04)24630321,1564,1196,2020/09/15 21:44:46
5903271148,重慶美得康藥局,臺中市西屯區重慶路１３９號１樓,臺中市西屯區重慶路139號1樓,24.166378,120.656241,(04)23111789,4905,330,2020/09/15 21:44:46
5903280067,博川健保藥局,臺中市南屯區大墩５街２９８號１樓,臺中市南屯區大墩5街298號1樓,24.1418941,120.6487086,(04)24732995,2704,750,2020/09/15 21:44:46
5903280101,成記大藥局,臺中市南屯區大墩１７街１２３號１樓,臺中市南屯區大墩17街123號1樓,24.1555649,120.6480325,(04)23288877,1131,1157,2020/09/15 21:44:46
5903280165,南屯福倫藥局,臺中市南屯區南屯路２段３１７號,臺中市南屯區南屯路2段317號,24.137521,120.645614,(04)24758018,1323,1520,2020/09/15 21:44:46
5903280245,大墩何藥局,臺中市南屯區大敦南路４３１號１．２樓,臺中市南屯區大敦南路431號1.2樓,24.134965,120.649802,(04)24710655,3375,0,2020/09/15 21:44:46
5903280325,亞洲連鎖大藥局,臺中市南屯區黎明路２段１３３、１３５號,臺中市南屯區黎明路2段133、135號,24.1453389,120.636477,(04)23812886,814,450,2020/09/15 21:44:46
5903280334,長益藥局,臺中市南屯區忠勇路９９號,臺中市南屯區忠勇路99號,24.1499387,120.6155779,(04)23899383,1968,0,2020/09/15 21:44:46
5903280361,誠美健保藥局,臺中市南屯區南屯路２段１６９號１樓,臺中市南屯區南屯路2段169號1樓,24.1360011,120.6509365,(04)24752000,2166,904,2020/09/15 21:44:46
5903280398,元生連鎖保健藥局,臺中市南屯區大墩路９２２號１樓,臺中市南屯區大墩路922號1樓,24.157129,120.65097,(04)23273267,5298,408,2020/09/15 21:44:46
5903280450,瑞安藥局,臺中市南屯區大墩路２６１號,臺中市南屯區大墩路261號,24.1429345,120.6497879,(04)24750818,3276,690,2020/09/15 21:44:46
5903280487,康詮藥師藥局,臺中市南屯區大墩路７３２號,臺中市南屯區大墩路732號,24.153297,120.649928,(04)23286688,1140,1400,2020/09/15 21:44:46
5903280521,百康健保藥局,臺中市南屯區黎明路二段３６３號,臺中市南屯區黎明路二段363號,24.150464,120.634745,(04)22547776,7,0,2020/09/15 21:44:46
5903280567,康總藥局,臺中市南屯區南屯路二段１０１號１樓,臺中市南屯區南屯路二段101號1樓,24.1357299,120.652364,(04)24735285,2922,897,2020/09/15 21:44:46
5903280576,佑全黎明藥局,臺中市南屯區黎明路２段２６６號,臺中市南屯區黎明路2段266號,24.148211,120.636005,(04)23805560,5270,810,2020/09/15 21:44:46
5903280585,康得藥局,臺中市南屯區向上路三段４５號,臺中市南屯區向上路三段45號,24.146229,120.635442,(04)23820981,2875,1840,2020/09/15 21:44:46
5903280594,東林藥局,臺中市南屯區黎明路二段１４０號,臺中市南屯區黎明路二段140號,24.1456137,120.636764,(04)23810567,2908,1303,2020/09/15 21:44:46
5903280601,方昇藥局,臺中市南屯區大墩路８１３號１樓,臺中市南屯區大墩路813號1樓,24.1551466,120.6495211,(04)23288818,1827,1460,2020/09/15 21:44:46
5903280638,心靜藥局,臺中市南屯區黎明路一段１１３８號,臺中市南屯區黎明路一段1138號,24.1415402,120.6382738,(04)23823977,3362,505,2020/09/15 21:44:46
5903280647,澄光人文藥局,臺中市南屯區干城街３０５號,臺中市南屯區干城街305號,24.1525973,120.6345354,(04)22530303,4688,282,2020/09/15 21:44:46
5903280656,熊大心藥局,臺中市南屯區河南路四段３７６號,臺中市南屯區河南路四段376號,24.1520809,120.6369133,(04)22516252,3171,891,2020/09/15 21:44:46
5903280683,詠悅藥局,臺中市南屯區大墩十二街６３７號,臺中市南屯區大墩十二街637號,24.1500825,120.6368591,(04)22515012,3501,0,2020/09/15 21:44:46
5903280692,富康藥局,臺中市南屯區大墩路３２３號１樓,臺中市南屯區大墩路323號1樓,24.144591,120.649635,(04)24722677,2339,1348,2020/09/15 21:44:46
5903280718,樂活藥局,臺中市南屯區大聖街３３２號１樓,臺中市南屯區大聖街332號1樓,24.1540553,120.6506595,(04)23106301,5219,961,2020/09/15 21:44:46
5903280727,大樹南屯藥局,臺中市南屯區向上路一段６４３號１樓,臺中市南屯區向上路一段643號1樓,24.1466986,120.6485878,(04)24758887,3321,0,2020/09/15 21:44:46
5903280736,大育藥局,臺中市南屯區東興路二段７１號１樓,臺中市南屯區東興路二段71號1樓,24.138347,120.652766,(04)24755656,4120,349,2020/09/15 21:44:46
5903280745,亨宇藥局,臺中市南屯區東興路二段２９－２號１樓,臺中市南屯區東興路二段29-2號1樓,24.136933,120.652761,(04)24711206,3233,773,2020/09/15 21:44:46
5903280754,弘泰藥師藥局,臺中市南屯區向心南路９４８號１樓,臺中市南屯區向心南路948號1樓,24.136706,120.644076,(04)24750790,6218,170,2020/09/15 21:44:46
5903280763,全順藥局,臺中市南屯區永春東路３３９號１樓,臺中市南屯區永春東路339號1樓,24.1345992,120.6476675,(04)24730983,2377,1058,2020/09/15 21:44:46
5903280781,美十樂藥局,臺中市南屯區東興路二段２７９號１樓,臺中市南屯區東興路二段279號1樓,24.1437359,120.652865,(04)24710219,4402,1092,2020/09/15 21:44:46
5903280790,統一藥局,臺中市南屯區黎明路一段１１９號１樓,臺中市南屯區黎明路一段119號1樓,24.114815,120.626038,(04)24701996,3014,130,2020/09/15 21:44:46
5903290045,康美得藥局,臺中市北屯區昌平路１段１０５－８號,臺中市北屯區昌平路1段105-8號,24.173803,120.690386,(04)22467128,893,1180,2020/09/15 21:44:46
5903290063,承恩藥局,臺中市北屯區北屯路４４１－１號１樓,臺中市北屯區北屯路441-1號1樓,24.1801848,120.700978,(04)22467857,3690,710,2020/09/15 21:44:46
5903290090,瑞士藥局,臺中市北屯區北屯路１９２－３號１樓,臺中市北屯區北屯路192-3號1樓,24.1657923,120.6949572,(04)22344853,1728,907,2020/09/15 21:44:46
5903290198,健康達人藥局,臺中市北屯區遼寧路１段６３號,臺中市北屯區遼寧路1段63號,24.1754438,120.6967197,(04)22471172,3260,1137,2020/09/15 21:44:46
5903290232,弘映藥局,臺中市北屯區崇德路２段４６７號,臺中市北屯區崇德路2段467號,24.1813389,120.685869,(04)22464485,4353,1118,2020/09/15 21:44:46
5903290312,大連大愛藥局,臺中市北屯區大連路２段２２１號,臺中市北屯區大連路2段221號,24.175759,120.6884081,(04)22428899,1782,930,2020/09/15 21:44:46
5903290385,元復藥局,臺中市北屯區東山路１段２２５－７號,臺中市北屯區東山路1段225-7號,24.1709445,120.6993312,(04)24362075,2183,1969,2020/09/15 21:44:46
5903290394,億銓藥局,臺中市北屯區北屯路２１０－１號,臺中市北屯區北屯路210-1號,24.1675026,120.6961191,(04)22313670,2175,755,2020/09/15 21:44:46
5903290456,百禾藥局中清店,臺中市北屯區中清路２段６００號１樓,臺中市北屯區中清路2段600號1樓,24.1829066,120.6658447,(04)22980980,0,1209,2020/09/15 21:44:46
5903290483,兩隻老虎藥局,臺中市北屯區崇德路２段１２號,臺中市北屯區崇德路2段12號,24.168693,120.685521,(04)22364635,4680,885,2020/09/15 21:44:46
5903290518,佳美藥局,臺中市北屯區東山路１段２６５號１樓,臺中市北屯區東山路1段265號1樓,24.1709445,120.6993312,(04)24363658,1206,0,2020/09/15 21:44:46
5903290572,合健藥局,臺中市北屯區大連路一段５４－１號,臺中市北屯區大連路一段54-1號,24.1755167,120.672168,(04)22951833,112,1437,2020/09/15 21:44:46
5903290607,敦化小林健保藥局,臺中市北屯區敦化路１段６６８號,臺中市北屯區敦化路1段668號,24.1860002,120.6647189,(04)24261881,2560,245,2020/09/15 21:44:46
